{
  "id": "system/du",
  "family": "system-disk",
  "description": "Compact du output while preserving size rows.",
  "match": {
    "toolNames": ["exec"],
    "argv0": ["du"]
  },
  "transforms": {
    "stripAnsi": true,
    "dedupeAdjacent": true,
    "trimEmptyEdges": true
  },
  "summarize": {
    "head": 14,
    "tail": 4
  },
  "failure": {
    "preserveOnFailure": true,
    "head": 16,
    "tail": 12
  },
  "counters": [
    {
      "name": "entry",
      "pattern": ".+"
    }
  ]
}
