{
  "id": "system/ps",
  "family": "system-processes",
  "description": "Compact ps output while preserving process rows.",
  "match": {
    "toolNames": ["exec"],
    "argv0": ["ps"]
  },
  "transforms": {
    "stripAnsi": true,
    "dedupeAdjacent": true,
    "trimEmptyEdges": true
  },
  "summarize": {
    "head": 14,
    "tail": 4
  },
  "failure": {
    "preserveOnFailure": true,
    "head": 16,
    "tail": 12
  },
  "counters": [
    {
      "name": "process",
      "pattern": ".+"
    }
  ]
}
