{
  "id": "devops/docker-ps",
  "family": "container-list",
  "description": "Compact docker ps output while preserving container rows.",
  "match": {
    "toolNames": ["exec"],
    "argv0": ["docker"],
    "argvIncludes": [["ps"]]
  },
  "transforms": {
    "stripAnsi": true,
    "dedupeAdjacent": true,
    "trimEmptyEdges": true
  },
  "summarize": {
    "head": 14,
    "tail": 4
  },
  "failure": {
    "preserveOnFailure": true,
    "head": 16,
    "tail": 12
  },
  "counters": [
    {
      "name": "container",
      "pattern": ".+"
    }
  ]
}
