{
  "id": "install/pnpm-install",
  "family": "dependency-install",
  "description": "Compact pnpm install output while preserving warnings and summary lines.",
  "match": {
    "toolNames": ["exec"],
    "argv0": ["pnpm"],
    "argvIncludes": [["install"]]
  },
  "transforms": {
    "stripAnsi": true,
    "dedupeAdjacent": true,
    "trimEmptyEdges": true
  },
  "summarize": {
    "head": 10,
    "tail": 8
  },
  "failure": {
    "preserveOnFailure": true,
    "head": 14,
    "tail": 14
  },
  "counters": [
    {
      "name": "warning",
      "pattern": "warn",
      "flags": "i"
    },
    {
      "name": "package",
      "pattern": "\\bpackages?\\b",
      "flags": "i"
    }
  ]
}
